{
  "$schema": "https://json-schema.org/draft/2020-12/schema",
  "$id": "https://local.ai-project-harness/schemas/review-verdict.schema.json",
  "title": "Review Verdict",
  "description": "Strict reviewer verdict. diff_fingerprint is head_sha + ':' + sha256(git diff --binary <base_sha>..<head_sha> -- . ':(exclude)reports/agent-runs/<stage-id>/status.json'). Missing or invalid JSON fails closed as non-accepting evidence and cannot pass a gate. REWORK verdicts must include fix_start_prompt so the controller can immediately dispatch a bounded fix task without re-summarizing the review. reviewer_prior_involvement discloses whether the reviewer participated in direction synthesis, development breakdown, or design before reviewing.",
  "type": "object",
  "additionalProperties": false,
  "allOf": [
    {
      "if": {
        "properties": {
          "verdict": {
            "const": "REWORK"
          }
        },
        "required": ["verdict"]
      },
      "then": {
        "required": ["fix_start_prompt"]
      }
    }
  ],
  "required": [
    "schema_version",
    "stage_id",
    "role",
    "model",
    "verdict",
    "diff_fingerprint",
    "reviewer_prior_involvement",
    "reviewed_artifacts",
    "findings",
    "required_fixes",
    "next_action"
  ],
  "properties": {
    "schema_version": {
      "type": "integer",
      "const": 1
    },
    "stage_id": {
      "type": "string",
      "minLength": 1
    },
    "role": {
      "type": "string",
      "enum": ["designer_review", "first_reviewer", "final_reviewer", "reality_checker"]
    },
    "model": {
      "type": "string",
      "minLength": 1
    },
    "verdict": {
      "type": "string",
      "enum": ["ACCEPT", "REWORK", "BLOCKED"]
    },
    "diff_fingerprint": {
      "type": "string",
      "description": "head_sha + ':' + sha256(git diff --binary <base_sha>..<head_sha> -- . ':(exclude)reports/agent-runs/<stage-id>/status.json')",
      "minLength": 1
    },
    "reviewer_prior_involvement": {
      "type": "string",
      "description": "Highest known prior participation by this reviewer/provider in the reviewed stage before this review. Prior implementation or fix authorship is not allowed for review-2 and must be caught by the workflow/validator, not normalized away here.",
      "enum": ["none", "direction_synthesis", "breakdown", "design"]
    },
    "reviewer_prior_involvement_notes": {
      "type": "string",
      "description": "Optional human-readable disclosure of the prior involvement and the evidence path or fallback reason when a strong-reviewer override is used."
    },
    "reviewed_artifacts": {
      "type": "array",
      "minItems": 1,
      "items": {
        "type": "string",
        "minLength": 1
      }
    },
    "findings": {
      "type": "array",
      "items": {
        "$ref": "#/$defs/finding"
      }
    },
    "required_fixes": {
      "type": "array",
      "items": {
        "type": "string"
      }
    },
    "residual_risks": {
      "type": "array",
      "items": {
        "type": "string"
      },
      "default": []
    },
    "fix_start_prompt": {
      "type": "string",
      "description": "Required when verdict is REWORK. A ready-to-send prompt for the fix implementer. It must preserve raw artifact paths, findings, required fixes, file boundaries, test commands, and success criteria. It must not hide reviewer evidence behind a controller summary.",
      "minLength": 1
    },
    "next_action": {
      "type": "string",
      "enum": [
        "continue",
        "fix",
        "human_gate",
        "retry",
        "fallback",
        "decision_models_exhausted",
        "development_models_exhausted",
        "stage_accepted_waiting_user",
        "human_escalation_required"
      ]
    }
  },
  "$defs": {
    "finding": {
      "type": "object",
      "additionalProperties": false,
      "required": ["severity", "title", "evidence", "impact", "recommendation"],
      "properties": {
        "severity": {
          "type": "string",
          "enum": ["P0", "P1", "P2", "P3"]
        },
        "title": {
          "type": "string",
          "minLength": 1
        },
        "file": {
          "type": "string"
        },
        "line": {
          "type": ["integer", "null"],
          "minimum": 1
        },
        "evidence": {
          "type": "string",
          "minLength": 1
        },
        "impact": {
          "type": "string",
          "minLength": 1
        },
        "recommendation": {
          "type": "string",
          "minLength": 1
        }
      }
    }
  }
}
