{
  "schema_version": 1,
  "stage_id": "2026-07-auto-review-pipeline-v1",
  "role": "first_reviewer",
  "model": "grok-4.5",
  "verdict": "ACCEPT",
  "diff_fingerprint": "846bec036d62a3cdb243325f16977bd2c1396ade:af3daf4d695f172c8c4d38fddbc6a6c491cfa62369b76a14402ace7615865b0b",
  "reviewer_prior_involvement": "none",
  "reviewer_prior_involvement_notes": "Parallel operator-invited first_reviewer of the review-2 fix unit only. Grok did not author commit 846bec0 (claude_glm). Distinct from any prior stage-level direction_synthesis involvement on the frozen 40 table.",
  "reviewed_artifacts": [
    "reports/agent-runs/2026-07-auto-review-pipeline-v1/50-review-2-gpt-5.6-sol.md",
    "reports/agent-runs/2026-07-auto-review-pipeline-v1/task-review2-fix-round1-claude-glm.prompt.md",
    "reports/agent-runs/2026-07-auto-review-pipeline-v1/task-review2-fix-round1-review1-kimi.prompt.md",
    "reports/agent-runs/2026-07-auto-review-pipeline-v1/51-review-2-panel-disposition.md",
    "reports/agent-runs/2026-07-auto-review-pipeline-v1/20-implementation.md",
    "reports/agent-runs/2026-07-auto-review-pipeline-v1/60-test-output.txt",
    "agents/registry.yaml",
    "schemas/review-verdict.schema.json",
    "scripts/auto-review-runner.py",
    "scripts/stage-seal.py",
    "scripts/tests/test_auto_review_runner.py",
    "scripts/tests/test_stage_seal.py"
  ],
  "findings": [],
  "required_fixes": [],
  "residual_risks": [
    "Trailing whitespace in reports/agent-runs/.../50-review-2-gemini.md within the commit range is outside the scripts/ fix writable set.",
    "F2 still uses approximate pathspec matching (fail-closed); consolidation into harness_stage_lib remains a P3 follow-up.",
    "_charge_auto_change increments rework_count before the > max_stage_rework check, so a terminal escalation may leave rework_count at max+1 transiently.",
    "F1 override-evidence form is out of this code fix unit; final review-2 must still confirm evidence v2 / design-conflict routing."
  ],
  "next_action": "human_gate"
}
