{
  "schema_version": 1,
  "stage_id": "2026-07-local-service-launchd-v1",
  "role": "first_reviewer",
  "model": "kimi-code/kimi-for-coding",
  "verdict": "ACCEPT",
  "diff_fingerprint": "85ab5011e4b99fe464d9e1996ad455fdbc389206:116eabe6e42623ee5f6cb84e9dfe470c2edeaf8ee649877c981244d530b3e778",
  "reviewer_prior_involvement": "none",
  "reviewed_artifacts": [
    "AGENTS.md",
    "workflows/templates/stage-delivery.yaml",
    "reports/agent-runs/2026-07-local-service-launchd-v1/00-task.md",
    "reports/agent-runs/2026-07-local-service-launchd-v1/10-design.md",
    "reports/agent-runs/2026-07-local-service-launchd-v1/11-adr.md",
    "reports/agent-runs/2026-07-local-service-launchd-v1/12-development-breakdown.md",
    "reports/agent-runs/2026-07-local-service-launchd-v1/13-software-architect-amendment.md",
    "reports/agent-runs/2026-07-local-service-launchd-v1/20-implementation.md",
    "reports/agent-runs/2026-07-local-service-launchd-v1/40-fix-report.md",
    "reports/agent-runs/2026-07-local-service-launchd-v1/60-test-output.txt",
    "reports/agent-runs/2026-07-local-service-launchd-v1/status.json",
    "reports/agent-runs/2026-07-local-service-launchd-v1/manual-fix-T1-launchd-service-attempt1.operator-forwarded-output.md",
    "reports/agent-runs/2026-07-local-service-launchd-v1/manual-fix-T1-launchd-service-attempt2.operator-forwarded-output.md",
    "schemas/review-verdict.schema.json",
    "backend/app/server.py",
    "backend/tests/test_service_health.py",
    "deploy/launchd/com.aoke.funding-hedging.server.plist.template",
    "scripts/service-control.py",
    "scripts/tests/test_service_control.py",
    "scripts/run-server.sh"
  ],
  "findings": [
    {
      "severity": "P3",
      "title": "诊断脱敏为正则最佳努力",
      "file": "scripts/service-control.py",
      "line": 73,
      "evidence": "_SECRET_KV_RE、_BEARER_RE、_APIKEY_HEADER_RE、_COOKIE_RE、_URL_USERINFO_RE 仅覆盖常见秘密模式；设计文档已将 _redact 定义为 best-effort。",
      "impact": "理论上仍可能漏掉自定义头部名或非常规凭证格式，但 base URL 校验已阻止凭证从主 URL 来源进入，.env 也未被读取。",
      "recommendation": "后续阶段若扩展私有渠道或引入新凭证来源，可扩充脱敏词典；本阶段保持现状可接受。"
    }
  ],
  "required_fixes": [],
  "residual_risks": [
    "诊断脱敏为正则最佳努力，不保证覆盖全部秘密模式；已通过 base URL 校验、不读取 .env、不复制环境等手段降低风险。",
    "真实 launchctl 安装/启动/停止/卸载仍为人工验收门，本阶段测试仅验证 argv 构造与隔离，未在真实用户 launchd 域运行。"
  ],
  "next_action": "continue"
}
