{
  "schema_version": 1,
  "stage_id": "2026-07-auto-review-pipeline-v1",
  "role": "final_reviewer",
  "model": "grok-4.5",
  "verdict": "ACCEPT",
  "diff_fingerprint": "a057d063523664a2fcfa8cc4db9e9af789f15730:cd68035686acc794aac3065270530ec6d4846da18c25274458f478fd85b84e7e",
  "reviewer_prior_involvement": "direction_synthesis",
  "reviewer_prior_involvement_notes": "xAI/Grok recorded and synthesized the frozen operator decision table (status.json.direction_synthesizer). This session is not OpenAI/Anthropic; it did not implement or fix delivery code (claude_glm only). Round-3 closure was re-verified from the frozen range a385c7a..a057d06, independent 161-test rerun, FX-class suite, source inspection, and executable shell/path probes rather than prior narrative. Operator explicitly authorized this session to land the two new review artifacts.",
  "reviewed_artifacts": [
    "agents/skills/reality-checker.md",
    "reports/agent-runs/2026-07-auto-review-pipeline-design-review/40-operator-decision-table.md",
    "reports/agent-runs/2026-07-auto-review-pipeline-v1/00-task.md",
    "reports/agent-runs/2026-07-auto-review-pipeline-v1/10-design.md",
    "reports/agent-runs/2026-07-auto-review-pipeline-v1/11-adr.md",
    "reports/agent-runs/2026-07-auto-review-pipeline-v1/50-review-2-round2-gpt-5.6-sol.md",
    "reports/agent-runs/2026-07-auto-review-pipeline-v1/review-2-round2-gpt-5.6-sol.verdict.json",
    "reports/agent-runs/2026-07-auto-review-pipeline-v1/task-review2-round2-fix-final-claude-glm.prompt.md",
    "reports/agent-runs/2026-07-auto-review-pipeline-v1/task-stage-review2-round3-operator-choice.prompt.md",
    "reports/agent-runs/2026-07-auto-review-pipeline-v1/20-implementation.md",
    "reports/agent-runs/2026-07-auto-review-pipeline-v1/60-test-output.txt",
    "reports/agent-runs/2026-07-auto-review-pipeline-v1/30-review-1-review2-round2-final-fix.md",
    "reports/agent-runs/2026-07-auto-review-pipeline-v1/review-1-review2-round2-final-fix.verdict.json",
    "reports/agent-runs/2026-07-auto-review-pipeline-v1/52-review-2-round2-panel-disposition.md",
    "reports/agent-runs/2026-07-auto-review-pipeline-v1/status.json",
    "reports/agent-runs/2026-07-auto-review-pipeline-v1/70-handoff.md",
    "AGENTS.md",
    "docs/auto-review-pipeline.md",
    "schemas/review-verdict.schema.json",
    "schemas/auto-review-authorization.schema.json",
    "schemas/runner-receipt.schema.json",
    "scripts/auto-review-runner.py",
    "scripts/stage-seal.py",
    "scripts/validate-stage.py",
    "scripts/harness_stage_lib.py",
    "scripts/tests/",
    "git diff a385c7ad77da1611c6e952b2219aee56b49f442f..a057d063523664a2fcfa8cc4db9e9af789f15730"
  ],
  "findings": [],
  "required_fixes": [],
  "residual_risks": [
    "R1: ResumeIdempotencyTests seed receipts use incrementing call_budget opposite production decrement; predicate uses only node + review_unit_id; production cross-probe confirms real receipts are recognized.",
    "R2: FX1 string-level enumeration covers 5/6 runner-reachable placeholder commands; missing claude_glm.embedded_read_only_review_command is shape-identical; bookkeeper and this review covered quote-safety more broadly.",
    "Full-range git diff --check still reports trailing whitespace only in raw Grok review artifacts and review-2-round2-unauthorized-writes-evidence.diff; gemini trailing whitespace from round-2 P2#3 is cleared; AGENTS.md does not rewrite raw model evidence.",
    "Historical manual fix packets omitted workflow skill references (recorded follow-up); round-3 packet cites reality-checker.md.",
    "AGENTS.md wording on design-conflict ineligibility vs runner-level unavailability for review-2 override remains a later Harness-contract clarification, not an open delivery defect.",
    "FX5 case A fail-closes any partially started non-ACCEPT unit to awaiting_human on resume; operational friction is intentional fail-closed, not a required defect.",
    "ACCEPT authorizes stage_accepted_waiting_user only; merge to main still requires explicit user acceptance. Rework ledger is exhausted at 3/3."
  ],
  "next_action": "stage_accepted_waiting_user"
}
