{
  "schema_version": 1,
  "stage_id": "2026-07-borrow-cost-coverage-v2",
  "role": "final_reviewer",
  "model": "codex/gpt-5",
  "verdict": "ACCEPT",
  "diff_fingerprint": "11c3935ec859320b5dad50d31c0068993b4bd8f5:2a73b681d0ae77f3d2d9d9eaed04f977be44dd1996a3bffef3ca8dfa52b7d401",
  "reviewer_prior_involvement": "design",
  "reviewer_prior_involvement_notes": "Codex/GPT wrote replaced DRAFT-1..3 pre-stage fix-plan drafts. Active design DRAFT-4/10-design and 00-stage-plan/12-development-breakdown were authored by Fable5; implementation was by claude_glm. I am not the active designer, breakdown author, implementer, or fix author. Provider identity is independent from implementation/fix authors, and this historical replaced-draft involvement does not impair review-2 independence.",
  "reviewed_artifacts": [
    "reports/agent-runs/2026-07-borrow-cost-coverage-v2/review-2-stage-by-codex.prompt.md",
    "reports/agent-runs/2026-07-borrow-cost-coverage-v2/status.json",
    "reports/agent-runs/2026-07-borrow-cost-coverage-v2/00-task.md",
    "reports/agent-runs/2026-07-borrow-cost-coverage-v2/11-adr.md",
    "reports/agent-runs/2026-07-borrow-cost-coverage-v2/12-development-breakdown.md",
    "reports/agent-runs/2026-07-borrow-cost-coverage-v2/20-implementation.md",
    "reports/agent-runs/2026-07-borrow-cost-coverage-v2/60-test-output.txt",
    "reports/agent-runs/2026-07-borrow-cost-coverage-v2/61-validate-pre-review.txt",
    "reports/agent-runs/2026-07-borrow-cost-coverage-v2/70-handoff.md",
    "reports/agent-runs/2026-07-borrow-cost-coverage-v2/embedded-review-H-round1.raw-output.md",
    "reports/agent-runs/2026-07-borrow-cost-coverage-v2/H.impl-note.md",
    "reports/agent-runs/2026-07-borrow-cost-coverage-v2/H.diff.patch",
    "reports/agent-runs/2026-07-borrow-cost-coverage-v2/H.live-smoke.md",
    "reports/agent-runs/2026-07-borrow-cost-coverage-v2/task-H-claude-glm.prompt.md",
    "reports/agent-runs/2026-07-borrow-cost-coverage-v2/10-design.md",
    "reports/agent-runs/2026-07-borrow-cost-coverage-v2/00-stage-plan.md",
    "reports/agent-runs/2026-07-borrow-cost-coverage-v2/gate-a-live.md",
    "reports/agent-runs/2026-07-borrow-cost-coverage-v2/gate-b-endpoint-recon.md",
    "backend/domain/snapshot.py",
    "backend/services/private_client.py",
    "backend/services/snapshot_service.py",
    "backend/tests/test_private_account_v1.py",
    "docs/api/public-market-contract.md",
    "schemas/api/public-market/snapshot.schema.json",
    "frontend/index.html",
    "frontend/self-check.js",
    "scripts/validate-stage.py",
    "command: git diff 5bdfc4b3dc6843a8e52aeb86896c735500ed137a..11c3935ec859320b5dad50d31c0068993b4bd8f5 -- backend frontend docs schemas",
    "command: python3 scripts/validate-stage.py 2026-07-borrow-cost-coverage-v2 --phase pre-review (passed)",
    "command: python3 -m pytest backend/tests -q (164 passed)",
    "command: node frontend/self-check.js (passed)"
  ],
  "findings": [],
  "required_fixes": [],
  "residual_risks": [
    "Harness round-1 finding is closed: status.json now records status=review_2, top-level base_sha/head_sha/diff_fingerprint with the committed-state scheme, review_1 uses the committed fingerprint, required checkpoint files exist, and validate-stage.py --phase pre-review passes with the same fingerprint.",
    "Contract closure is complete: backend assemble_borrow_validation keeps daily_interest_account for borrowability_truncated, docs/api/public-market-contract.md documents borrowability_not_probed, frontend badge and self-check cover the sixth state while preserving not_probed_this_round, and backend tests assert both borrowability_not_probed and borrow_rate_source=null paths. schemas/api/public-market/snapshot.schema.json required no edit because borrow_validation.error is string|null, not an enum.",
    "Bookkeeper decision to reject whole-table merged_next_hourly caching is correct: per-batch _cached_get plus 60s snapshot caching provides same-snapshot dedupe, while a whole-table cache would persist partial failed-batch results for the private 1h TTL and break failed-batch self-heal on the next snapshot.",
    "Serial mode decision is acceptable: skipping parallel-only dispatch-ready is consistent with this atomic non-parallel stage, and the general pre-review gate now passes.",
    "Redlines remain satisfied: reviewed committed diff adds no order, borrow, repay, or transfer path; rate math remains Decimal-based; no key or secret fragments were introduced; bStock negative-funding borrow remains disabled by the CRYPTO candidate filter.",
    "Known deferred risk remains intentionally out of scope: live smoke reports 15 CRYPTO next-hourly subset-miss rows left without fabricated rates, deferred to per-asset-cost-leg-v1."
  ],
  "next_action": "stage_accepted_waiting_user"
}
