{
  "schema_version": 1,
  "stage_id": "2026-07-auto-review-pipeline-v1",
  "role": "first_reviewer",
  "model": "kimi-code/kimi-for-coding",
  "verdict": "ACCEPT",
  "diff_fingerprint": "a057d063523664a2fcfa8cc4db9e9af789f15730:cd9756c95f45834c120b72fa16ffeec1a9f5fe7e3b86225ff05bb0a90a2a80c2",
  "reviewer_prior_involvement": "none",
  "reviewer_prior_involvement_notes": "This session previously served as review-1 for the round-1 fix unit in this stage, which is a review role and not captured by the schema's direction_synthesis/breakdown/design enum. There is no prior implementation, fix authorship, direction synthesis, breakdown, or design involvement with the FINAL fix unit under review.",
  "reviewed_artifacts": [
    "scripts/auto-review-runner.py",
    "scripts/stage-seal.py",
    "scripts/tests/test_auto_review_runner.py",
    "scripts/tests/test_stage_seal.py",
    "reports/agent-runs/2026-07-auto-review-pipeline-v1/20-implementation.md",
    "reports/agent-runs/2026-07-auto-review-pipeline-v1/60-test-output.txt",
    "reports/agent-runs/2026-07-auto-review-pipeline-v1/50-review-2-round2-gpt-5.6-sol.md",
    "reports/agent-runs/2026-07-auto-review-pipeline-v1/task-review2-round2-fix-final-claude-glm.prompt.md",
    "agents/skills/code-reviewer.md",
    "schemas/review-verdict.schema.json",
    "git diff 846bec036d62a3cdb243325f16977bd2c1396ade..a057d063523664a2fcfa8cc4db9e9af789f15730"
  ],
  "findings": [],
  "required_fixes": [],
  "residual_risks": [
    "R1: seed receipts in ResumeIdempotencyTests use incrementing call_budget (before: seq-1, after: seq) opposite to production decrement semantics; the predicate under test only uses node + review_unit_id, and a production cross-probe confirms real receipts are recognized, so there is no behavioral impact.",
    "R2: FX1 string-level enumeration in ShellSafeInvocationTests covers 5 of the 6 runner-reachable placeholder commands in agents/registry.yaml, missing claude_glm.embedded_read_only_review_command (shape-identical to covered cases); the bookkeeper independently verified all 6, and the real execution probes pass in both production contexts.",
    "Trailing whitespace exists in the review range but only in raw Grok review artifacts and an evidence diff file; per AGENTS.md these are not rewritten for Markdown hard-break normalization."
  ],
  "next_action": "continue"
}
