{
  "schema_version": 1,
  "stage_id": "2026-07-auto-review-pipeline-v1",
  "role": "first_reviewer",
  "model": "kimi-code/kimi-for-coding",
  "verdict": "ACCEPT",
  "diff_fingerprint": "25383e86d0b10b3e8bd3e0f51254588826c9601b:242cff3040ac66e79ce2dbb5a13dab6bf92043765884ed9f0288cf8decc80486",
  "reviewer_prior_involvement": "none",
  "reviewed_artifacts": [
    "reports/agent-runs/2026-07-auto-review-pipeline-design-review/40-operator-decision-table.md",
    "reports/agent-runs/2026-07-auto-review-pipeline-v1/00-task.md",
    "reports/agent-runs/2026-07-auto-review-pipeline-v1/10-design.md",
    "reports/agent-runs/2026-07-auto-review-pipeline-v1/11-adr.md",
    "reports/agent-runs/2026-07-auto-review-pipeline-v1/12-development-breakdown.md",
    "reports/agent-runs/2026-07-auto-review-pipeline-v1/20-implementation.md",
    "reports/agent-runs/2026-07-auto-review-pipeline-v1/60-test-output.txt",
    "reports/agent-runs/2026-07-auto-review-pipeline-v1/status.json",
    "schemas/review-verdict.schema.json",
    "schemas/auto-review-authorization.schema.json",
    "schemas/runner-receipt.schema.json",
    "reports/agent-runs/_template/status.json",
    "reports/agent-runs/_template/70-handoff.md",
    "AGENTS.md",
    "workflows/templates/stage-delivery.yaml",
    "agents/registry.yaml",
    "docs/auto-review-pipeline.md",
    "docs/model-adapters.md",
    "docs/parallel-development-mode.md",
    "reports/agent-runs/README.md"
  ],
  "findings": [],
  "required_fixes": [],
  "residual_risks": [
    "A1 deferred: docs/auto-review-pipeline.md not promoted in AGENTS.md Authority Order; recorded as design-amendment candidate.",
    "T2/T3 implementation must realize this written contract; T1 does not include executable runner/seal code.",
    "Review-2 routing remains unresolved in status.json and requires operator decision before final review."
  ],
  "next_action": "human_gate"
}
