{
  "schema_version": 1,
  "stage_id": "2026-07-history-background-refresh-v1",
  "role": "first_reviewer",
  "model": "kimi-code/kimi-for-coding",
  "verdict": "ACCEPT",
  "diff_fingerprint": "6c9f8f2f8a4e71dc59d1866b0f9acc616104ffbb:f81403b21f91b1c7b7a9fbf167f423d02061773920fdee9b51711fa97c3bad96",
  "reviewer_prior_involvement": "none",
  "reviewed_artifacts": [
    "AGENTS.md",
    "workflows/templates/stage-delivery.yaml",
    "reports/agent-runs/2026-07-history-background-refresh-v1/00-task.md",
    "reports/agent-runs/2026-07-history-background-refresh-v1/10-design.md",
    "reports/agent-runs/2026-07-history-background-refresh-v1/11-adr.md",
    "reports/agent-runs/2026-07-history-background-refresh-v1/12-development-breakdown.md",
    "reports/agent-runs/2026-07-history-background-refresh-v1/20-implementation.md",
    "reports/agent-runs/2026-07-history-background-refresh-v1/60-test-output.txt",
    "reports/agent-runs/2026-07-history-background-refresh-v1/status.json",
    "reports/api-samples/2026-07-history-background-refresh-v1/20260713T000000Z/capture.md",
    "reports/api-samples/2026-07-history-background-refresh-v1/20260713T000000Z/raw/fapi-v1-premiumIndex-BTCUSDT.json",
    "reports/api-samples/2026-07-history-background-refresh-v1/20260713T000000Z/raw/fapi-v1-fundingRate-BTCUSDT-limit1000.json",
    "reports/api-samples/2026-07-history-background-refresh-v1/20260713T000000Z/signed-audit-template.json",
    "backend/services/snapshot_service.py",
    "backend/services/private_client.py",
    "backend/adapters/binance_public.py",
    "backend/app/server.py",
    "backend/config.py",
    "backend/domain/snapshot.py",
    "frontend/index.html",
    "frontend/self-check.js",
    "backend/tests/test_background_worker.py",
    "backend/tests/test_symbol_snapshot_endpoint.py",
    "schemas/api/public-market/symbol-snapshot.schema.json",
    "schemas/review-verdict.schema.json"
  ],
  "findings": [],
  "required_fixes": [],
  "residual_risks": [
    "真实 live signed capture（force-TTL 在生产 key 下的实网脱敏录制）仍为操作者授权后的 follow-up，未在本 bounded task 中完成；实现者已用脱敏 fake-key 单元测试验证行为级语义。"
  ],
  "next_action": "continue"
}
