{
  "schema_version": 1,
  "stage_id": "2026-07-local-service-launchd-v1",
  "role": "final_reviewer",
  "model": "claude-opus-4-8",
  "verdict": "ACCEPT",
  "diff_fingerprint": "ed7d9e0a71d05aab15cc1ecad2f8197989b54b9d:75d865afaa68b0895e8c2843d8d5fcc264a4ab1b9feddb36dd2529a9ce49100e",
  "reviewer_prior_involvement": "breakdown",
  "reviewer_prior_involvement_notes": "Executor identity: Claude/Anthropic Opus 4.8 (claude-opus-4-8), the recorded review-2 fallback the human assigned. Per review-2-routing-design-conflict-evidence.md, review-2-routing-human-opus48-override.md, and status.json.breakdown_author, Anthropic authored 12-development-breakdown.md via Opus 4.8, so reviewer_prior_involvement=breakdown. Correction disclosure: this is the SAME dedicated read-only reviewer session reused for the post-fix recheck; not a fresh session. That dedicated reviewer session never implemented or fixed any code; all delivery and P2 repair authorship is zhipu_glm (glm-5.2), so review-2 implementation/fix provider isolation still holds. This recheck used only non-mutating inspection (git diff/show and file reads); no file write, no .env read, no server start, no network/private-channel probe, no launchctl. This turn re-read current reality-checker.md/schema/00-task/10-design/status.json/80-escalation-tcc/manual-review-1 verdict and the delivery source, and actually chunk-inspected the COMPLETE committed diff git diff --binary 3bb253a..ed7d9e0 -- . ':(exclude)reports/.../status.json' across every changed path (five delivery files plus run-server.sh unchanged; and the stage's auto-pilot Harness prerequisites: AGENTS.md, agents/registry.yaml, docs/auto-review-pipeline.md, docs/model-adapters.md, schemas/runner-receipt.schema.json, schemas/runner-tool-policy.schema.json, workflows/templates/stage-delivery.yaml, reports/agent-runs/ACTIVE.json, scripts/harness_stage_lib.py, scripts/validate-stage.py, scripts/model-adapters/claude-glm-wrapper, scripts/model-adapters/claude-glm-pty-wrapper, scripts/auto-review-runner.py, and the three scripts/tests changes), not only a hash/stat or the 85ab501..ed7d9e0 P2 delta. The recomputed fingerprint equals the immutable bind. The prior review-2 P1 (real launchd fails from the ~/Desktop TCC-protected checkout, exit 126) is resolved by the user's authoritative runtime-acceptance scope amendment (22-human-runtime-acceptance-amendment.md), which honestly retains the exit-126 evidence as an environment limitation rather than a launchd PASS; PRD/ARCHITECTURE do not make launchd terminal-independence a hard product requirement (11-adr scopes it as an operational utility). The prior P2 is fixed by a bounded post-bootstrap readiness gate. The Harness infrastructure changes in-range are the stage's documented auto-pilot prerequisites (14-18 repair reports), are safe (shlex.quote on all substituted values, Bash and .env/.git/AGENTS/workflows/agents/schemas/reports writes denied, never logs alias/env, PTY fails closed on synthetic/sdk-cli), and introduce no funding-hedging product change and no secret leak.",
  "reviewed_artifacts": [
    "git diff --binary 3bb253a489bf2854d8b9d81060a45ca056e1cea2..ed7d9e0a71d05aab15cc1ecad2f8197989b54b9d -- . ':(exclude)reports/agent-runs/2026-07-local-service-launchd-v1/status.json' (complete committed diff, chunk-inspected across all changed paths; fingerprint recomputed and matched)",
    "AGENTS.md",
    "workflows/templates/stage-delivery.yaml",
    "docs/product/PRD.md",
    "docs/architecture/ARCHITECTURE.md",
    "docs/auto-review-pipeline.md",
    "docs/model-adapters.md",
    "agents/registry.yaml",
    "agents/skills/reality-checker.md",
    "schemas/review-verdict.schema.json",
    "schemas/runner-receipt.schema.json",
    "schemas/runner-tool-policy.schema.json",
    "reports/agent-runs/ACTIVE.json",
    "reports/agent-runs/2026-07-local-service-launchd-v1/00-intake.md",
    "reports/agent-runs/2026-07-local-service-launchd-v1/00-task.md",
    "reports/agent-runs/2026-07-local-service-launchd-v1/10-design.md",
    "reports/agent-runs/2026-07-local-service-launchd-v1/11-adr.md",
    "reports/agent-runs/2026-07-local-service-launchd-v1/12-development-breakdown.md",
    "reports/agent-runs/2026-07-local-service-launchd-v1/13-software-architect-amendment.md",
    "reports/agent-runs/2026-07-local-service-launchd-v1/20-implementation.md",
    "reports/agent-runs/2026-07-local-service-launchd-v1/22-human-runtime-acceptance-amendment.md",
    "reports/agent-runs/2026-07-local-service-launchd-v1/30-review-1.md",
    "reports/agent-runs/2026-07-local-service-launchd-v1/40-fix-report.md",
    "reports/agent-runs/2026-07-local-service-launchd-v1/50-review-2.md",
    "reports/agent-runs/2026-07-local-service-launchd-v1/60-test-output.txt",
    "reports/agent-runs/2026-07-local-service-launchd-v1/70-handoff.md",
    "reports/agent-runs/2026-07-local-service-launchd-v1/status.json",
    "reports/agent-runs/2026-07-local-service-launchd-v1/80-escalation-real-launchd-desktop-tcc-20260713T134341Z.md",
    "reports/agent-runs/2026-07-local-service-launchd-v1/manual-review-1-T1-launchd-service.operator-forwarded-output.md",
    "reports/agent-runs/2026-07-local-service-launchd-v1/manual-review-1-T1-launchd-service.verdict.json",
    "reports/agent-runs/2026-07-local-service-launchd-v1/manual-review-2-T1-launchd-service.opus.raw-output.md",
    "reports/agent-runs/2026-07-local-service-launchd-v1/manual-review-2-T1-launchd-service.opus.verdict.json",
    "reports/agent-runs/2026-07-local-service-launchd-v1/manual-fix-T1-launchd-service-review2-P2-attempt1.raw-output.md",
    "reports/agent-runs/2026-07-local-service-launchd-v1/manual-fix-T1-launchd-service-review2-P2-attempt2.raw-output.md",
    "reports/agent-runs/2026-07-local-service-launchd-v1/review-2-routing-design-conflict-evidence.md",
    "scripts/harness_stage_lib.py",
    "scripts/validate-stage.py",
    "scripts/auto-review-runner.py",
    "scripts/model-adapters/claude-glm-wrapper",
    "scripts/model-adapters/claude-glm-pty-wrapper",
    "scripts/tests/test_auto_review_runner.py",
    "scripts/tests/test_harness_stage_lib.py",
    "scripts/tests/test_validate_stage_auto_review.py",
    "backend/app/server.py",
    "backend/tests/test_service_health.py",
    "deploy/launchd/com.aoke.funding-hedging.server.plist.template",
    "scripts/service-control.py",
    "scripts/tests/test_service_control.py",
    "scripts/run-server.sh"
  ],
  "findings": [
    {
      "severity": "P3",
      "title": "诊断脱敏为 best-effort 正则（设计已声明的可接受残余）",
      "file": "scripts/service-control.py",
      "line": 73,
      "evidence": "_SECRET_KV_RE/_BEARER_RE/_APIKEY_HEADER_RE/_COOKIE_RE/_URL_USERINFO_RE 覆盖常见秘密模式，_redact docstring 明确声明 best-effort；test_service_control.py 断言 signed query/Cookie/Set-Cookie/X-MBX-APIKEY/Bearer/URL userinfo 的 dummy 字节不出现在任何 doctor bundle 文件。",
      "impact": "理论上仍可能漏掉自定义头名或非常规凭证格式；但 base URL 校验阻断凭证从主 URL 进入、控制器从不读取 .env、plist 不含秘密，主来源已受控，风险有限，不构成开放 P0/P1。",
      "recommendation": "后续若扩展私有渠道或引入新凭证来源再扩充脱敏词典；本阶段保持现状可接受，作为残余风险记录，非必修项。"
    }
  ],
  "required_fixes": [],
  "residual_risks": [
    "诊断脱敏为 best-effort 正则，不保证覆盖全部秘密模式；已由 base URL 校验、不读取 .env、不复制环境、plist 无秘密共同降低。",
    "真实 launchd 生命周期在当前 ~/Desktop TCC 保护位置无法独立运行（exit 126），已由用户运行时验收修正案显式接受为环境限制；本机常规启动/可视验收改用人工启动的 scripts/run-server.sh。该 launchd 控制器仍是面向非 TCC 保护 checkout 的可用交付。",
    "实现/修复作者(zhipu_glm)历史过程偏离：P2 attempt-1 两次只读 grep（attempt-2 无偏离），均只读且未触碰交付边界/.env/真实 launchctl，pre-review 与 review-1 已披露，不影响代码接受性。",
    "冻结范围内含本 stage 的 auto-pilot Harness 前置改动（adapter wrapper/tool-policy/runner/validator），已随 14-18 报告留档并具确定性测试；均无产品语义改动、无秘密泄露，但属交付 T1 之外的基础设施面，随分支一并合并。",
    "真实安装/合并/推送仍是本终态后的显式人工门；本裁决仅推进到 stage_accepted_waiting_user，不授权合并到 main。"
  ],
  "next_action": "stage_accepted_waiting_user"
}
