{
  "schema_version": 1,
  "stage_id": "2026-07-borrow-cost-coverage-v2",
  "role": "final_reviewer",
  "model": "codex/gpt-5",
  "verdict": "REWORK",
  "diff_fingerprint": "11c3935ec859320b5dad50d31c0068993b4bd8f5:2a73b681d0ae77f3d2d9d9eaed04f977be44dd1996a3bffef3ca8dfa52b7d401",
  "reviewer_prior_involvement": "design",
  "reviewer_prior_involvement_notes": "Codex/GPT wrote replaced DRAFT-1..3 pre-stage fix-plan drafts; active design DRAFT-4/10-design and 00-stage-plan/breakdown were authored by Fable5. I am not implementation/fix author, reviewed raw artifacts and code diff independently; this historical involvement does not by itself impair review-2 independence, so verdict is not blocked for identity.",
  "reviewed_artifacts": [
    "reports/agent-runs/2026-07-borrow-cost-coverage-v2/review-2-stage-by-codex.prompt.md",
    "reports/agent-runs/2026-07-borrow-cost-coverage-v2/status.json",
    "reports/agent-runs/2026-07-borrow-cost-coverage-v2/embedded-review-H-round1.raw-output.md",
    "reports/agent-runs/2026-07-borrow-cost-coverage-v2/H.impl-note.md",
    "reports/agent-runs/2026-07-borrow-cost-coverage-v2/H.diff.patch",
    "reports/agent-runs/2026-07-borrow-cost-coverage-v2/H.live-smoke.md",
    "reports/agent-runs/2026-07-borrow-cost-coverage-v2/task-H-claude-glm.prompt.md",
    "reports/agent-runs/2026-07-borrow-cost-coverage-v2/10-design.md",
    "reports/agent-runs/2026-07-borrow-cost-coverage-v2/00-stage-plan.md",
    "reports/agent-runs/2026-07-borrow-cost-coverage-v2/gate-a-live.md",
    "reports/agent-runs/2026-07-borrow-cost-coverage-v2/gate-b-endpoint-recon.md",
    "backend/domain/snapshot.py",
    "backend/services/private_client.py",
    "backend/services/snapshot_service.py",
    "backend/tests/test_private_account_v1.py",
    "docs/api/public-market-contract.md",
    "schemas/api/public-market/snapshot.schema.json",
    "frontend/index.html",
    "frontend/self-check.js",
    "scripts/validate-stage.py",
    "workflows/templates/stage-delivery.yaml",
    "command: git diff 5bdfc4b3dc6843a8e52aeb86896c735500ed137a..HEAD -- backend frontend docs schemas",
    "command: python3 -m pytest backend/tests -q (164 passed)",
    "command: node frontend/self-check.js (passed)",
    "command: python3 scripts/validate-stage.py 2026-07-borrow-cost-coverage-v2 --phase pre-review (failed)"
  ],
  "findings": [
    {
      "severity": "P1",
      "title": "Harness pre-review gate state is invalid, so review-2 cannot accept yet",
      "file": "reports/agent-runs/2026-07-borrow-cost-coverage-v2/status.json",
      "line": 3,
      "evidence": "status.json records status=dispatch-ready and review_1.diff_fingerprint=worktree:919de191112cb57397437ff4b6dd9a9603069165bf573be532da8ee66b217f4b. Running python3 scripts/validate-stage.py 2026-07-borrow-cost-coverage-v2 --phase pre-review failed with status not allowed, pre-review requiring review_1 or review_2, missing top-level base_sha/head_sha/diff_fingerprint, and missing 00-task.md, 11-adr.md, 20-implementation.md, 60-test-output.txt, and 70-handoff.md.",
      "impact": "The delivery code is reviewable and tests pass, but an ACCEPT verdict would bypass the committed-state fingerprint and pre-review validation hard gates. The stage cannot safely move to stage_accepted_waiting_user until the bookkeeper state and evidence satisfy the Harness validator or an explicit schema/workflow amendment is made.",
      "recommendation": "Bookkeeper-only rework: move the stage to a valid review_2 state, record top-level base_sha/head_sha/diff_fingerprint using the standard committed fingerprint scheme, replace worktree fingerprint metadata, add or reconcile the required checkpoint files, preserve the pre-review validator output, and redispatch review-2 against the recorded committed diff. Do not change delivery code unless the revalidation exposes real drift."
    }
  ],
  "required_fixes": [
    "Normalize status.json to a Harness-allowed pre-review state, including top-level base_sha, head_sha, and standard diff_fingerprint for the committed review range.",
    "Remove or replace worktree: fingerprint metadata with the committed-state fingerprint scheme required by schemas/review-verdict.schema.json and scripts/validate-stage.py.",
    "Create or reconcile the missing required checkpoint/evidence files for this stage, or land an explicit Harness schema/workflow amendment before relying on the serial shortcut.",
    "Rerun and preserve python3 scripts/validate-stage.py 2026-07-borrow-cost-coverage-v2 --phase pre-review; only redispatch review-2 after it passes."
  ],
  "residual_risks": [
    "Contract closure conclusion: backend assemble_borrow_validation, docs/api/public-market-contract.md, frontend badge, frontend self-check, and backend tests are synchronized for borrowability_not_probed; schemas/api/public-market/snapshot.schema.json has error as string|null rather than a constrained enum, so the stage-plan additive schema condition did not require a schema edit.",
    "Cache-decision conclusion: not adopting Opus 4.6 whole-table merged_next_hourly cache is correct. Per-batch _cached_get plus the 60s snapshot cache is enough for same-snapshot dedupe, while a whole-table cache would pin a partial failed batch result for the 1h private TTL and break failed-batch self-heal.",
    "Serial routing conclusion: skipping validate-stage.py --phase dispatch-ready is acceptable for this non-parallel serial stage, but it does not waive the pre-review validator gate, which is the blocking finding above.",
    "Implementation redline conclusion: reviewed code diff adds no order, borrow, repay, or transfer path; rate math remains Decimal-based; no key or secret fragments are recorded; bStock negative-funding borrow remains excluded by the CRYPTO candidate filter.",
    "Known deferred product risk: live smoke reports 15 CRYPTO next-hourly subset-miss rows left without rates by design, not fabricated, and deferred to the separate per-asset cost-leg follow-up."
  ],
  "fix_start_prompt": "Stage 2026-07-borrow-cost-coverage-v2 review-2 returned REWORK for Harness evidence/state only. Bookkeeper-only scope; do not edit delivery code unless revalidation exposes real drift. Normalize status.json (allowed review_2 state; top-level committed base/head/diff_fingerprint; drop worktree fingerprint), create missing checkpoint files, rerun python3 scripts/validate-stage.py --phase pre-review until pass, then redispatch review-2 against the committed diff.",
  "next_action": "fix"
}
