{"schema_version": 1, "stage_id": "2026-07-auto-review-pipeline-v1", "role": "first_reviewer", "model": "kimi-code/kimi-for-coding", "verdict": "ACCEPT", "diff_fingerprint": "433980d8384304a528ab5633591aa8dc4018b6ed:5316c5dee336354eacc762af913f1cb6cadcb73f13b1dadfc5536e8686b3ca97", "reviewer_prior_involvement": "none", "reviewed_artifacts": ["AGENTS.md", "workflows/templates/stage-delivery.yaml", "agents/registry.yaml", "docs/auto-review-pipeline.md", "docs/model-adapters.md", "docs/parallel-development-mode.md", "docs/harness-design.md", "reports/agent-runs/README.md", "reports/agent-runs/_template/status.json", "reports/agent-runs/_template/70-handoff.md", "schemas/auto-review-authorization.schema.json", "schemas/runner-receipt.schema.json", "schemas/review-verdict.schema.json", "scripts/auto-review-runner.py", "scripts/harness_stage_lib.py", "scripts/validate-stage.py", "scripts/tests/test_auto_review_runner.py", "scripts/tests/test_harness_stage_lib.py", "scripts/tests/test_validate_stage_auto_review.py", "reports/agent-runs/2026-07-auto-review-pipeline-v1/status.json", "reports/agent-runs/2026-07-auto-review-pipeline-v1/70-handoff.md", "reports/agent-runs/2026-07-auto-review-pipeline-v1/16-serial-v1-slimming-design.md", "reports/agent-runs/2026-07-auto-review-pipeline-v1/12-serial-v1-slimming-development-breakdown-codex.md", "reports/agent-runs/2026-07-auto-review-pipeline-v1/18-bookkeeper-inspection-T4.md", "reports/agent-runs/2026-07-auto-review-pipeline-v1/19-model-routing-convergence-operator-decision.md", "reports/agent-runs/2026-07-auto-review-pipeline-v1/20-implementation.md", "reports/agent-runs/2026-07-auto-review-pipeline-v1/60-test-output.txt"], "findings": [{"severity": "P3", "title": "status.json changed_files 未完整反映实际 diff 范围", "file": "reports/agent-runs/2026-07-auto-review-pipeline-v1/status.json", "line": 168, "evidence": "status.json 的 changed_files 仅列出 7 项，未包含 AGENTS.md、agents/registry.yaml、docs/*、schemas/*、scripts/*、reports/agent-runs/README.md、reports/agent-runs/_template/70-handoff.md 等实际已变更的源文件；git diff --stat 显示 24 个文件变更。", "impact": "机器可读摘要与 git diff --stat 不一致，可能使后续审计或 bookkeeper checkpoint 对变更范围产生误判。", "recommendation": "bookkeeper 在更新 status.json 和 70-handoff.md 时同步 changed_files，使其与本次 diff 的实际变更文件一致；本项不阻塞 review-1 通过。"}], "required_fixes": [], "residual_risks": ["status.json changed_files 列表不完整，需在下一 checkpoint 修正。", "agents/registry.yaml 的 direction_panels.2026_07_initial_direction 仍保留历史 grok-build 成员标识；该保留符合 19-model-routing-convergence-operator-decision.md 的历史面板身份要求，但若未来 direction panel 统一收敛，需单独处理。"], "next_action": "continue"}
