{
  "schema_version": 1,
  "stage_id": "2026-07-auto-review-pipeline-v1",
  "role": "final_reviewer",
  "model": "grok-4.5",
  "verdict": "ACCEPT",
  "diff_fingerprint": "846bec036d62a3cdb243325f16977bd2c1396ade:53c4a3e650a9f34d635233d253f553456bdef74b5babdda00507829a475c15f4",
  "reviewer_prior_involvement": "direction_synthesis",
  "reviewer_prior_involvement_notes": "Grok/xAI synthesized/recorded the frozen 40-operator-decision-table after dual GPT+Fable5 decision-table review. Not stage designer (OpenAI), not breakdown author or acting bookkeeper (Anthropic), not implementer/fix author (zhipu_glm). Operator-invited parallel review-2 round-2 panel member under design-conflict override evidence v2. Highest authority remains the user-approved 40 table.",
  "reviewed_artifacts": [
    "reports/agent-runs/2026-07-auto-review-pipeline-design-review/40-operator-decision-table.md",
    "reports/agent-runs/2026-07-auto-review-pipeline-v1/task-stage-review2-round2-operator-choice.prompt.md",
    "reports/agent-runs/2026-07-auto-review-pipeline-v1/50-review-2-gpt-5.6-sol.md",
    "reports/agent-runs/2026-07-auto-review-pipeline-v1/51-review-2-panel-disposition.md",
    "reports/agent-runs/2026-07-auto-review-pipeline-v1/task-review2-fix-round1-claude-glm.prompt.md",
    "reports/agent-runs/2026-07-auto-review-pipeline-v1/20-implementation.md",
    "reports/agent-runs/2026-07-auto-review-pipeline-v1/60-test-output.txt",
    "reports/agent-runs/2026-07-auto-review-pipeline-v1/30-review-1-review2-fix-round1.md",
    "reports/agent-runs/2026-07-auto-review-pipeline-v1/30-review-1-review2-fix-round1-grok.md",
    "reports/agent-runs/2026-07-auto-review-pipeline-v1/review-1-review2-fix-round1.verdict.json",
    "reports/agent-runs/2026-07-auto-review-pipeline-v1/review-1-review2-fix-round1-grok.verdict.json",
    "reports/agent-runs/2026-07-auto-review-pipeline-v1/review-2-unrelated-reviewer-unavailable-evidence.md",
    "reports/agent-runs/2026-07-auto-review-pipeline-v1/status.json",
    "reports/agent-runs/2026-07-auto-review-pipeline-v1/70-handoff.md",
    "AGENTS.md",
    "workflows/templates/stage-delivery.yaml",
    "agents/registry.yaml",
    "docs/auto-review-pipeline.md",
    "schemas/auto-review-authorization.schema.json",
    "schemas/runner-receipt.schema.json",
    "schemas/review-verdict.schema.json",
    "scripts/harness_stage_lib.py",
    "scripts/stage-seal.py",
    "scripts/validate-stage.py",
    "scripts/auto-review-runner.py",
    "scripts/tests/test_auto_review_runner.py",
    "scripts/tests/test_stage_seal.py",
    "scripts/tests/test_harness_stage_lib.py",
    "scripts/tests/test_validate_stage_auto_review.py",
    "harness-manifest.yaml"
  ],
  "findings": [],
  "required_fixes": [],
  "residual_risks": [
    "status.json blockers[0] still claims fix round pending dispatch, and review_2.open_p0_p1 remains 7, contradicting delivered fix 846bec0 and re-review-1 double ACCEPT; bookkeeper must clear these when binding official stage_accepted_waiting_user (hygiene, not a new code fix).",
    "A1 Authority Order promotion remains deferred as a documented design-amendment candidate.",
    "Duplicate approximate _pathspec_matches in runner and stage-seal remain a P3 drift risk; exotic forms fail closed.",
    "agents/registry.yaml still lists codex.default_model gpt-5.5 while operator review-2 pool uses GPT-5.6 family; manual dispatch unaffected.",
    "_charge_auto_change increments rework_count before the > max_stage_rework check, so a terminal escalation may leave rework_count at max+1 transiently (fail-closed still holds).",
    "This Grok verdict is an operator-invited parallel final-review opinion; Grok is not a registered decision model—bookkeeper/operator may bind a GPT/Claude record as authoritative and treat this file as corroboration."
  ],
  "next_action": "stage_accepted_waiting_user"
}
