{"schema_version": 1, "stage_id": "2026-07-history-background-refresh-v1", "role": "final_reviewer", "model": "claude-opus-4-8 (manual fallback for claude-fable-5; disclosed per 50-review-2.prompt.md adapter rule)", "verdict": "ACCEPT", "diff_fingerprint": "6c9f8f2f8a4e71dc59d1866b0f9acc616104ffbb:f81403b21f91b1c7b7a9fbf167f423d02061773920fdee9b51711fa97c3bad96", "reviewer_prior_involvement": "breakdown", "reviewer_prior_involvement_notes": "Anthropic provider 曾在本阶段做 design review 并作为 12-development-breakdown.md 的作者（自述 provider=Anthropic, model=Opus 4.8），故披露 breakdown 级别涉入。证据：reports/agent-runs/2026-07-history-background-refresh-v1/31-review-2-routing-disclosure.md。Codex 当前 session 是设计作者/bookkeeper，不能签发 formal verdict；无其它已注册且未参与设计的 provider-isolated decision model；Anthropic 与实现/修复 provider zhipu_glm 隔离。额外诚实披露（超出上述预期范围）：本 review-2 由 claude-opus-4-8 执行（Fable5 fallback），与 breakdown 作者疑为同一 Anthropic 模型，构成比 provider 级更强的 reviewer-independence 冲突。此技术 ACCEPT 有效但携带该披露；是否在合并前追加一个真正独立（非 Anthropic）的 review-2，属操作者在 merge 人机门的裁量，本 verdict 不代其决定。", "reviewed_artifacts": ["AGENTS.md", "workflows/templates/stage-delivery.yaml", "reports/agent-runs/2026-07-history-background-refresh-v1/00-task.md", "reports/agent-runs/2026-07-history-background-refresh-v1/10-design.md", "reports/agent-runs/2026-07-history-background-refresh-v1/11-adr.md", "reports/agent-runs/2026-07-history-background-refresh-v1/12-development-breakdown.md", "reports/agent-runs/2026-07-history-background-refresh-v1/20-implementation.md", "reports/agent-runs/2026-07-history-background-refresh-v1/60-test-output.txt", "reports/agent-runs/2026-07-history-background-refresh-v1/70-handoff.md", "reports/agent-runs/2026-07-history-background-refresh-v1/30-review-1.md", "reports/agent-runs/2026-07-history-background-refresh-v1/30-review-1.verdict.json", "reports/agent-runs/2026-07-history-background-refresh-v1/31-review-2-routing-disclosure.md", "reports/api-samples/2026-07-history-background-refresh-v1/20260713T000000Z/capture.md", "reports/api-samples/2026-07-history-background-refresh-v1/20260713T000000Z/raw/fapi-v1-premiumIndex-BTCUSDT.json", "reports/api-samples/2026-07-history-background-refresh-v1/20260713T000000Z/raw/fapi-v1-fundingRate-BTCUSDT-limit1000.json", "reports/api-samples/2026-07-history-background-refresh-v1/20260713T000000Z/signed-audit-template.json", "backend/services/snapshot_service.py", "backend/services/private_client.py", "backend/adapters/binance_public.py", "backend/app/server.py", "backend/config.py", "backend/domain/snapshot.py", "schemas/api/public-market/symbol-snapshot.schema.json", "frontend/index.html", "frontend/self-check.js", "backend/tests/test_background_worker.py", "backend/tests/test_symbol_snapshot_endpoint.py", "backend/tests/test_private_client.py", "backend/tests/test_funding_history_endpoint.py", "backend/tests/test_config.py", "schemas/review-verdict.schema.json"], "findings": [], "required_fixes": [], "residual_risks": ["真实 live signed capture（force-TTL 在生产 key 下的实网脱敏录制）仍为操作者授权后的 follow-up；本轮仅有公开 raw 样本 + 脱敏 fake-key force-TTL 行为级单元测试，signed-audit-template.json 已明确标注 TEMPLATE ONLY，未伪装为事实。", "默认视图选择集大小 N 与单次全扫时间需在实网实测记录，对照 ceil(N/10)*30s < 1800s 约束（当前 N≈50-56，余量充裕）。", "防御性观察（当前不触发）：snapshot_service._gather_private_inputs 的点击 reuse 分支依赖『每次发布都写入非 None 的 private_account / price_map』不变式，来保证点击路径不 fetch 余额/持仓/全量 ticker；该不变式因 worker bootstrap 先执行 _scheduled_tick 而恒成立，但缺少显式守卫，未来改动若破坏它可能使点击落入 fetch 分支。建议加断言/守卫固化。", "reviewer-independence：本 review-2 的 fallback reviewer 与 development breakdown 作者疑为同一 Anthropic 模型（Opus 4.8）；合并前操作者应在人机门决定是否追加独立非 Anthropic 审查。"], "next_action": "stage_accepted_waiting_user"}
