{
  "schema_version": 1,
  "stage_id": "2026-07-red-gate-greening-v1",
  "role": "final_reviewer",
  "model": "gpt5.6-sol",
  "verdict": "ACCEPT",
  "diff_fingerprint": "49529b3:6bed788e17bd1b50149254f536fb1598f81006b16169fd01965899c75a149071",
  "reviewer_prior_involvement": "none",
  "reviewed_artifacts": [
    "ledger commit d18bcd026911c4a8fca78db7cfd094241e8c5694",
    "git diff 0ac4997..d18bcd0",
    "reports/agent-runs/2026-07-red-gate-greening-v1/status.json",
    "reports/agent-runs/ACTIVE.json",
    "reports/agent-runs/2026-07-red-gate-greening-v1/40-fix-report.md",
    "reports/agent-runs/2026-07-red-gate-greening-v1/70-handoff.md",
    "reports/agent-runs/2026-07-red-gate-greening-v1/74-review-fix-round-gpt5.6-sol.md",
    "reports/agent-runs/2026-07-red-gate-greening-v1/74-review-fix-round-gpt5.6-sol.verdict.json",
    "reports/agent-runs/2026-07-red-gate-greening-v1/75-review-fix-round-fable5.md",
    "reports/agent-runs/2026-07-red-gate-greening-v1/76-dispatch-kimi-ledger-final.md",
    "reports/agent-runs/2026-07-red-gate-greening-v1/73-fixture-baseline-postfix-funding.json",
    "reports/agent-runs/2026-07-red-gate-greening-v1/73-fixture-baseline-postfix-template.json",
    "reports/agent-runs/2026-07-bookticker-open-columns-v1/status.json"
  ],
  "findings": [],
  "required_fixes": [],
  "residual_risks": [
    "The direct-fix stage intentionally remains one of the eight registered known-red stages under the user's F3(a) ruling.",
    "docs-truth-sync remains a registered class-2 known-red pending user decision D-i.",
    "Waypoint ancestor ordering remains the registered K4 hygiene follow-up.",
    "The full historical fix range retains intentional Markdown trailing whitespace in immutable raw review 69; the scoped diff-check excluding that raw artifact passes."
  ],
  "next_action": "continue"
}