{
  "schema_version": 1,
  "stage_id": "2026-07-auto-review-pipeline-v1",
  "role": "first_reviewer",
  "model": "kimi-code/kimi-for-coding",
  "verdict": "ACCEPT",
  "diff_fingerprint": "a7fd7373545e581a2b25f4643917dc213e998f66:2509ae831482876ed47dfedfbb41941c672a0035c60487cd0c12876362072b97",
  "reviewer_prior_involvement": "none",
  "reviewed_artifacts": [
    "reports/agent-runs/2026-07-auto-review-pipeline-v1/12-development-breakdown.md",
    "reports/agent-runs/2026-07-auto-review-pipeline-v1/10-design.md",
    "docs/auto-review-pipeline.md",
    "schemas/auto-review-authorization.schema.json",
    "schemas/runner-receipt.schema.json",
    "workflows/templates/stage-delivery.yaml",
    "reports/agent-runs/2026-07-auto-review-pipeline-v1/00-task.md",
    "reports/agent-runs/2026-07-auto-review-pipeline-v1/20-implementation.md",
    "reports/agent-runs/2026-07-auto-review-pipeline-v1/60-test-output.txt",
    "scripts/harness_stage_lib.py",
    "scripts/stage-seal.py",
    "scripts/validate-stage.py",
    "scripts/tests/test_harness_stage_lib.py",
    "scripts/tests/test_stage_seal.py",
    "scripts/tests/test_validate_stage_auto_review.py"
  ],
  "findings": [],
  "required_fixes": [],
  "residual_risks": [
    "P3: scripts/stage-seal.py _pathspec_matches is an approximate git pathspec matcher (literal, /**, /*, trailing-/); git remains the staging authority, and the current coverage is acceptable for the seal boundary, but exotic pathspec shapes should be retested when the runner exercises parallel topology in T3."
  ],
  "next_action": "human_gate"
}
